{
  "chrom": "LG28",
  "windows": [
    { "idx": 0, "K": 2, "labels": [1, 0, 1, 0, 1, 0, 1, 0] },
    { "idx": 1, "K": 2, "labels": [1, 0, 1, 0, 1, 0, 1, 0] },
    { "idx": 2, "K": 2, "labels": [0, 0, 0, 0, 1, 1, 1, 1] },
    { "idx": 3, "K": 2, "labels": [0, 0, 0, 0, 1, 1, 1, 1] },
    { "idx": 4, "K": 2, "labels": [0, 0, 0, 0, 1, 1, 1, 1] },
    { "idx": 5, "K": 2, "labels": [1, 1, 1, 1, 0, 0, 0, 0] },
    { "idx": 6, "K": 2, "labels": [0, 0, 0, 0, 1, 1, 1, 1] },
    { "idx": 7, "K": 2, "labels": [0, 1, 0, 1, 0, 1, 0, 1] },
    { "idx": 8, "K": 2, "labels": [0, 1, 0, 1, 0, 1, 0, 1] },
    { "idx": 9, "K": 2, "labels": [0, 1, 0, 1, 0, 1, 0, 1] }
  ],
  "anchors": [4],
  "input_layer_ids": ["scrubber_main:LG28"]
}
